{
  "schema_version": 1,
  "received_at": "2024-03-15T13:00:09.100000Z",
  "stage": "fhir",
  "error_code": "PID_BIRTH_DATE_INVALID",
  "error_detail": "PID-7 is not a valid date",
  "control_id": "SIM000009",
  "raw_base64": "TVNIfF5+XCZ8V1dTSU18V0FSRFdBVENIX0lDVXxXQVJEV0FUQ0h8V0FSRFdBVENIfDIwMjQxMzE1MTMwMDA1KzAwMDB8fE9SVV5SMDFeT1JVX1IwMXxTSU0wMDAwMDh8UHwyLjUuMQ0=",
  "raw_truncated": false
}
